{
  "schemaVersion": 1,
  "feature": "Add due dates to tasks",
  "slug": "001-due-dates",
  "phase": "done",
  "gates": {
    "spec_approved": {
      "approved": true,
      "by": "speedy",
      "at": "2026-08-02T22:56:10Z"
    },
    "plan_approved": {
      "approved": true,
      "by": "speedy",
      "at": "2026-08-02T22:59:00Z"
    },
    "verification_passed": {
      "approved": true,
      "by": "sdlc-verify",
      "at": "2026-08-02T23:10:00Z"
    },
    "docs_complete": {
      "approved": true,
      "by": "sdlc-document",
      "at": "2026-08-02T23:13:00Z"
    }
  },
  "artifacts": {
    "spec": "spec.md",
    "plan": "plan.md",
    "verification": "verification.md"
  },
  "updatedAt": "2026-08-02T23:13:00Z"
}
